"""Burpees"" para perder kilos sin salir de casa";Burpees
una hidratación con los tratamientos reafirmantes adecuados es la base para conseguir un makeup flawless y juvenil.;makeup flawless
"aunque han fijado un dresscode sporty, es ""importante saber a dónde se viene, no puede presentarse uno en pijama"", afirma el anfitrión.";dresscode sporty
la cadena ha popularizado los poke bowls healthy que ahora vemos por toda la ciudad.;poke bowls healthy
la actriz lució un look total black en el estreno de la película;look;black
una visita a zara o a h m nos puede apañar un outfit low cost con el que apañar la temporada de bodas que se avecina.;outfit;cost
receta para preparar una carrot cake vegan friendly;friendly
esta temporada triunfa el estilo noventero, como las chaquetas vaqueras, los leggings animal print o los estampados imposibles.;leggings;print
censurada en varios países por sus escenas explícitas, esta road movie hot promete ser la cinta más polémica del festival.;movie hot
para conseguir la mejor taza de café posible decántate por un specialty coffee fair trade y de agricultura ecológica.;specialty coffee;trade
estuvo durante un tiempo a tiempo parcial, pero ahora trabaja como head hunter full time.;head;time
para una date night foodie, te recomendamos el nuevo local del cocinero lorenzo romero, aunque para conseguir mesa es imprescindible reservar.;date night foodie
falsificó los papeles y la policía acabó deteniéndole en el control de aduana, cuando intentó cruzar la frontera con una green card fake.;fake
Burpees Para Perder Kilos Sin Salir De Casa
Cool, Cómoda Y Versátil: La Gabardina Que Está De Moda Esta Temporada
Pipeline De Canalización De Datos De Código Abierto Para Almacenar Y Extraer Información
Dealer De Estupefacientes Detenido En Una Operación Antidroga
Eyeliner A Todo Color Para Para Un Verano Fantástico
"Frame De La Nueva Serie ""Big Little Lies"" De Netflix";Big Little Lies
Hate, Falta De Privacidad Y Ciberdelincuencia: La Cara Oculta De Las Redes
Hoodie Con Capucha, Botines Y Gafas De Pasta Conforman El Atuendo Que Le Han Hecho Famoso.
Revival De Los Ochenta En Los Carnavales De Este Año
Gamer, Mujer Y Homosexual: La Nueva Estrella Del Partido Republicano
Bad Hair Day: Un Mal Día De Estilismo Lo Tiene Cualquiera
Curtain Fringe: El Flequillo Que Crea Tendencia Esta Temporada
Eye Liner A Todo Color Para Para Un Verano Fantástico
Golden Visa Solo Para Millonarios: Así Se Reparten Los Visados De Oro Entre Extranjeros
Home Cinema Y Palomitas Para Disfrutar Del Cine Sin Salir De Casa
"Season Finale De Infarto De ""Prision Break"" Esta Noche A Las 21h En Cartoon Network";Prision Break
Goal Average Al Límite Para El Desempatar Entre El Valencia Y El Liverpool
Medal Race Entre Nigeria Y Polonia Por La Plata En Atletismo
Oil Free Y Sin Parabenos: Así Son Las Cremas Solares Que Recomiendan Los Dermatólogos
¿Open Source O Código Proprietario?
Las Sentadillas, Las Flexiones O Los Burpees Son Métodos Muy Efectivos Para Perder Peso En Un Periodo Corto De Tiempo.
Estos Zapatos De Plataforma Ya Sea En Negro O En Modelos Estampados Resultan Cómodos, Elegantes Y Muy Cool.
La Empresa Cuenta Ya Con Un Pipeline De 2 Gw En Alemania Y Está Avanzando En La Contratación De Un Equipo Local Para La Sede De Liechtenstein
No Es Raro Que En Los Festivales Te Den Directamente El Teléfono Del Dealer De Confianza
Para La Ocasión Lució Un Maquillaje Muy Natural, Con Eyeliner Marrón Y Sin Pestañas Postizas
En El Revisionado A Cámara Lenta Es Posible Apreciar El Frame Exacto En El Que El Actor Pierde El Hilo
Las Artistas Denuncian Las Campañas De Hate Y Acoso Machista Organizado Que Reciben
El Estilismo Desenfadado De Hoodie Y Camiseta Deportiva Son Su Marca Inconfudible Y Ahora Lo Ha Convertido En Una Línea De Moda Muy Rentable
Las Hombreras, Los Cardados Imposibles Y La Música De Mecano Confirman Que Estamos Inmersos En El Enésimo Revival De Los Años Ochenta
Las Descomunales Sillas Y Los Focos Con Luz Azul Tenue Son Parte De La Estética Gamer Que Tanto Ha Popularizado El Conocido Ibai Llanos
Sin Que Sirva De Precedente Y Solo Porque Somos Entusiastas De Sus Arriesgados Peinados, Le Perdonamos Al Actor El Bad Hair Day Con El Que Nos Sorprendió Durante La Alfombra Roja
Cortado Por Encima De Las Cejas Y Ladeado Hacia Las Sienes, El Curtain Fringe Vuelve A Triunfar Este Año
Para La Ocasión Lució Un Maquillaje Muy Natural, Con Eye Liner Marrón Y Sin Pestañas Postizas
El Gobierno Pone Contra Las Cuerdas A Las Inmobiliarias De Lujo Por La Prohibición De Las Golden Visa.
Disfrutar Del Cine En Casa Es Posible Con Un Buen Aparato De Home Cinema O Un Proyector De Gran Calidad
Ninguno De Los Actores Quiso Revelar Qué Sueldo Recibieron Por Participar En La Season Finale De La Serie.
A Falta De Tres Jornadas Para El Final Del Campeonato, Los Siete Puntos De Ventaja Más El Goal Average Parecen Suficientes Para Garantizar La Victoria De Los Rojiblancos
Ambos Países Se Han Visto Envueltos En Una Medal Race De Infarto, Cuyo Desenlace Se Resolverá En La Semifinal Del Próximo Jueves
Las Pieles Grasas Y Con Tendencia Acneica Preferirán Decantarse Por La Fórmula Oil Free Del Producto
Los Investigadores Critican La Opacidad De Esta Tecnología Y Reclaman Modelos Open Source Que Puedan Ser Utilizados Sin Coste Y Auditados De Manera Transparente.
Healthy Food Fácil Y Asequible Para Perder Los Kilos De Navidad
Buddy Movie Y Palomitas Para Disfrutar Del Cine Sin Salir De Casa
Early Adopter, Mujer Y Homosexual: La Nueva Estrella Del Partido Republicano
Garden Party A Las 7 Amenizada Por Una Banda De Música
Guilty Pleasures Setenteros Para Animar Tus Listas De Spotify
Joint Ventures De Todo El Mundo Se Reúnen Estos Días En Madrid Para La Mayor Feria Mundial De La Industria
Revenge Dress: El Vestido De Lady Di Que Hizo Historia Y Robó El Corazón Del Pueblo Británico
Sensitivity Reader Además De Actriz, Smith Se Ganó El Aplauso De La Crítica Con Su Primera Película
Smash Burger Vegana Y Con Un Punto Picante
Tie Break Entre Nadal Y Federer En Un Desempate De Infarto
Los Amantes Del Healthy Food Encontrarán Opciones Saludables En Los Lineales De La Tienda
Nada Como Una Noche De Mantita, Sofá Y Una Buena Buddy Movie Para Irse A Dormir Con Una Sonrisa.
Frente Al Consumidor Tradicional Más Conservador, El Early Adopter Es El Cliente Ávido Por Hacerse Con El Último Cacharrito Del Mercado
Los Farolillos De Papel Y Las Flores Son Elementos Decorativos Que No Pueden Faltar En Una Garden Party Veraniega.
Esos Temazos Mamarrachos Que Te Avergüenzan Pero Que No Puedes Dejar De Escuchar Confeccionan Lo Que Se Conoce Como Guilty Pleasures.
Empresas Del Sector Confirman La Fusión De Ambas Compañías, Lo Que Supondría Un Hito En La Historia De Las Joint Ventures En Luxemburgo.
Algunas Voces Alertan De Que Considerar El Revenge Dress Como Algo Machista Banaliza El Gran Poder Que Tiene La Moda Como Lenguaje Y Sistema De Comunicación.
La Labor Del Sensitivity Reader No Es Otra Que La De Detectar Posibles Sesgos, Prejuicios O Estereotipos Indeseados En El Texto En Cuestión.
Con Su Cebollita Crujiente, Su Pan Esponjoso Y Una Salsa Ligeramente Agridulce, A Quién No Se Le Haría La Boca Agua Con Una Smash Burger Como Esta?
Hubo Que Esperar Al Tie Break Para Ver A La Tenista Remontar Y Desplegar El Juego Ofensivo E Implacable Al Que Nos Tiene Acostumbrados.
Blue Collar, Mujer Y Homosexual: La Nueva Estrella Del Partido Republicano
Casual Looks Con Bufanda Y Guantes Para Triunfar Esta Temporada
Dad Jean Sin Bolsillos Y De Tiro Alto: La Nueva Moda En La Pasarela De Milán
Data Scientist, Ingeniero De Inteligencia Artificial Y Técnico En Visualización De Datos Son Las Carreras Más Demandadas Ahora Mismo En España
Escape Rooms De Todo El Mundo Se Reúnen Estos Días En Madrid Para La Mayor Feria Mundial De La Industria
Gluten Free Y Sin Azúcar: El Desayuno Saludable Que Recomiendan Los Dietistas
Late Nights Y Actualidad Son Los Géneros Que Copan La Programación Televisiva
Personal Trainer Además De Actriz, Smith Se Ganó El Aplauso De La Crítica Con Su Primera Película
Red Carpet Pasada Por Agua En La Quincuagésima Tercera Edición De Los Premios De La Academia
Time Lapse De La Puesta De Sol Captado Desde La Marisma De Doñana
Su Trabajo Como Data Scientist Ha Dado También Frutos En El Sector Farmacéutico, Donde Sus Modelos Sobre Plegamiento De Proteínas Han Dado Pie A Una Nueva Generación De Fármacos
Tacones Y Vestidazos Dejan Hueco A Casual Looks Más Alegres Y Festivos, Donde Hasta El Chándal Tiene Protagonismo.
Un Dad Jean Es El Vaquero De Corte Amplio Y Holgado Que Esperaríamos Encontrar En El Armario De Un Señor De Más De 50 Años Y Poco Gusto Por La Moda.
Los Trabajadores Blue Collar Son El Principal Granero De Votos Del Partido Nacionalista, Donde Cosecha Porcentajes De Intención De Voto De Hasta El 50
Para Los Escépticos De Las Discotecas O De Los Planes Al Aire Libre, Las Escape Rooms Son Una Excelente Opción Para Cumpleaños Y Celebraciones Grupales Diferentes.
Los Celíacos Encontrarán En La Carta Apetitosas Raciones Gluten Free Para Escoger.
La Directora Se Ha Dejado Ver Estos Días Como Invitada En Tertulias Y Diversos Late Nights, Donde Ha Contado Algunos Detalles Del Proceso Creativo Detrás De Su Primer Documental.
Solo, En Clase Colectiva O Con Personal Trainer, Cualquier Forma De Ejercicio Mejora La Salud Cardiovascular Y La Función Genitourinaria.
Ídolos, Cantantes, Actores, Publicistas Y Hasta Un Cirujano En La Red Carpet Más Variopinta Y Estrafalaria Que Hemos Visto En Mucho Tiempo.
Requiere Paciencia, Buen Equipamiento Técnico Y Que La Meteorología Esté De Nuestra Parte, Pero Los Resultados Del Time Lapse Merecen La Pena Y Crearán Un Recuerdo Espectacular Para Toda La Vida.
Trendsetter, Mujer Y Homosexual: La Nueva Estrella Del Partido Republicano
Cupcakes Sin Azúcar Pero Con Todo El Sabor
Oversize, Cómoda Y Versátil: La Gabardina Está De Moda Esta Temporada
Reboot Del Clásico Setentero Esta Noche En Tve
Sharenting: Cuando La Vida De Los Hijos Se Convierte En Negocio
"Skyline De Nueva York En Película De Woody Allen ""Manhattan""";Manhattan
Spoilers Del Episodio Siete A Continuación
Streamer, Ingeniero De Inteligencia Artificial Y Técnico En Visualización De Datos Son Las Carreras Más Demandadas Ahora Mismo En España
Afterparty Hasta El Amanecer Tras La Gala De Los Premios De La Academia
"Cliffhanger De Infarto En ""Prision Break"" Esta Noche A Las 21h En Cartoon Network";Prision Break
Beauty Expert, Ingeniero De Inteligencia Artificial Y Técnico En Visualización De Datos Son Las Carreras Más Demandadas Ahora Mismo En España
Fact Checkers Confirman Que La Cifra Aportada Por El Ministerio No Es Correcta Y Solicitan Más Información A La Fiscalía
Fast Fashion: Un Problema De Consumismo Que Afecta Al Medio Ambiente
Girl Bands Y Solistas Se Suman A La Campaña Para Reclamar Mayor Presencia Femenina En Los Festivales De Música
Glass Skin: Cómo Conseguir El Efecto Piel De Cristal Que Lucen Las Famosas
Jumping Jacks Para Perder Kilos Sin Salir De Casa
King Size Y Viscoelástico: El Colchón Que Tu Espalda Necesita
Talk Shows Y Actualidad Son Los Géneros Que Copan La Programación Televisiva
Ugly Shoes A Todo Color Para Para Un Verano Fantástico
Wedding Planners De Todo El Mundo Se Reúnen Estos Días En Madrid Para La Mayor Feria Mundial De La Industria
Mariano Rajoy, El Nuevo Trendsetter Que Agotó El Abrigo Que Ha Llevado En Washington Dc.
Los Cupcakes Son Como Magdalenas Hipertrofiadas Recubiertas Por Toneladas De Azúcar Y Decoradas Con Todo Tipo De Fantasías Hechas A Golpe De Colorante Alimentario.
No Debemos Subestimar Las Posibilidades De Las Prendas Oversize Para Aportar Un Toque Sofisticado Y Moderno A Nuestra Indumentaria.
El Reboot De La Serie No Se Prevé Para El Próximo Otoño, Pero Los Fanáticos De La Saga Ya Han Comenzado A Calentar Motores.
La Madre Ha Sido Acusada En Numeriosas Ocasiones De Exponer A La Menor En Redes Sociales En Un Caso Claro De Sharenting.
El Perfil De La Almudena Y Del Palacio Real Vistos Desde El Otro Lado Del Río Manzanares Perfilan La Imagen Del Clásico Skyline Madrileño.
Las Horas Posteriores Al Estreno Del Capítulo Son Un Campo De Minas, Porque Es Fácil Tropezar Involuntariamente Con Mensajes De Desaprensivos Llenos De Spoilers Y Acabar Comiéndose Alguno.
En La Afterparty Del Evento Pudimos Ver A Algunas De Las Caras Más Conocidas Del Universo Cinematográfico
El Capítulo Terminó Con Un Cliffhanger Inesperado Que Deja La Trama En El Aire
El Streamer Ha Negado Las Acusaciones Que Señalan Que Hizo Publicidad Encubierta, Algo Que La Agencia Europea Condena Con Multas De Hasta 50000 Euros.
La Cobertura Del Debate Electoral Se Hará Con Un Ejército De Fact Checkers Que Se Ocuparán De Contrastar Los Datos Aportados Por Los Candidatos Durante El Programa.
El Problema De La Fast Fashion Es Triple: Consume Recursos Desmesuradamente, Produce Toneladas De Basura De Difícil Reciclaje Y Fomenta La Explotación Laboral De La Industria Textil.
En Los Noventa Asistimos A Un Auge De De Presencia Femenina En El Mundo De La Música, Tanto Solistas Como Tracy Chapman O Girl Bands Como Las Spice Girls.
Con Los Productos Adecuados Y Una Rutina De Cuidado De La Piel Que Seguiremos Estrictamente, Podemos Lograr El Aspecto Glass Skin O Piel De Cristal.
Las Sentadillas, Las Flexiones O Los Jumping Jacks Son Métodos Muy Efectivos Para Perder Peso En Un Periodo Corto De Tiempo.
"Las Tiendas De Colchones Confirman La Tendencia Creciente De Las Camas Grandes; La Tradicional Cama De 1, 35 Ha Sido Desplazada Por El Tamaño King Size Estadounidense, Más Propio De Un Hotel De Lujo Que De La Típica Casa Española."
La Directora Se Ha Dejado Ver Estos Días Como Invitada En Tertulias Y Diversos Talk Shows, Donde Ha Contado Algunos Detalles Del Proceso Creativo Detrás De Su Primer Documental.
Feos Pero Distinguidos, Los Ugly Shoes Que Lució Nicole Kidman Han Agotado Existencias En Apenas Unos Días.
Si La Avalancha De Tareas Que Conlleva Organizar Una Boda Reservar Un Sitio, Elegir Menú, Encargar Las Flores, Contratar Una Orquesta Te Abruman, Debes Saber Que Las Wedding Planners Pueden Ser Tu Solución.
Puedes Contratar Una Beauty Expert Y Disfrutar Del Conocimiento Para Optimizar Vuestras Rutinas Sin Salir De Casa.
En Toronto Habrá Un Fan Festival De 3000 Personas, Que Se Reunirán Para Seguir El Barça Madrid
Un Fatal Error Ocurre Típicamente Cuando El Programa Intenta Dividir Por Cero
Durante Su Carrera Profesional, También Ha Sido Socio Y Director General De Ikea, Global Director De Apple Y Director De Comunicación De Basket Market.
En El Me Time Nosotras Debemos Ser La Prioridad, Ha De Ser Placentero Y Hemos De Poder Disfrutarlo Sin Interrupciones
Los Defensores Del Natural Time Proponen Distribuir El Calendario En 13 Meses De 28 Días, Lo Que Hace Un Total De 364 Días.
El Concurso Presentado Por Aitor Albizua Se Ha Consolidado En El Prime Time De Telecinco Gracias A Su Participante Estrella, Un Muchacho Que Está Deslumbrando A Los Espectadores Con Su Rapidez A La Hora De Resolver Operaciones Matemáticas.
Las Trabas Burocráticas O Red Tape Que Asolan Su Administración Impiden Que El Flujo Financiero De La Ue Abarque Proyectos Estratégicos Para La Reconversión Del Modelo Productivo Sueco
Greensmaniac, El Salad Bar De Moda Aterriza En Barcelona
De Hecho, Lo Que Busca A Través De Sus Social Media Es Lograr Un Contacto Real Y Directo Con Sus Seguidores.
La Reina Letizia Ha Escogido Un Conjunto Total Red Para La Boda De Los Príncipes De De Holanda
Si Por El Contrario Tenemos La Piel Seca O Deshidratada, Es Aconsejable Elegir Un Primer De Efecto Hidratante.
Receta De Pie De Limón Paso A Paso Y Sin Horno
Dragados Pone A La Venta Su Antigua Sede Central En Barcelona Para Vivienda Prime
Pero Si Quieres Aprovechar Las Rebajas, Te Proponemos Un Listado De Gadgets Beauty Para Sacarle Todo El Partido A Los Descuentos
Acostumbrados A Verla Con Autendos Imposibles Y Maquillajes Muy Recargados, La Modelo Nos Ha Sorprendido Con Un Look Effortless Sencillo Y Natural Que Le Quita Años Y Muestra Su Cara Más Informal.
La Agencia Reivindica La Publicidad En Medios Clásicos Como La Radio Y La Televisión Y Desaconseja Fiarlo Todo A Campañas De Marketing Online.
"Eduardo Noriega Se Ha Hecho Con El Título De ""Hombre Mejor Vestido De La Velada"" Gracias A Su Trench Oversize Con Mocasines A Conjunto."
Tras Años En La Industria De Los Videojuegos, Dio Un Giro Radical A Su Carrera Y Ahora Trabaja Como Coach Wellness Asesorando A Trabajadores Quemados Y Personas En Busca Del Bienestar Físico Y Emocional
La Película Es Un Thriller Queer Con Esteroides, Una Crítica A Todos Los Mensajes Meritocráticos Y De Filosofía Barata Con Los Que Nos Inundan A Diario
Birkenstock, La Marca Que Reafirma La Tendencia De Las Sneakers Chunky
Si El Pincho Usb Convencional Te Da Problemas, Puedes Probar Con Un Pendrive Smart, Que Goza De Conectividad Autónoma Y No Necesita Configuración Externa.
Una Hidratación Con Los Tratamientos Reafirmantes Adecuados Es La Base Para Conseguir Un Makeup Flawless Y Juvenil.
"Aunque Han Fijado Un Dresscode Sporty, Es ""Importante Saber A Dónde Se Viene, No Puede Presentarse Uno En Pijama"", Afirma El Anfitrión."
La Cadena Ha Popularizado Los Poke Bowls Healthy Que Ahora Vemos Por Toda La Ciudad.
La Actriz Lució Un Look Total Black En El Estreno De La Película
Una Visita A Zara O A H M Nos Puede Apañar Un Outfit Low Cost Con El Que Apañar La Temporada De Bodas Que Se Avecina.
Receta Para Preparar Una Carrot Cake Vegan Friendly
Esta Temporada Triunfa El Estilo Noventero, Como Las Chaquetas Vaqueras, Los Leggings Animal Print O Los Estampados Imposibles.
Censurada En Varios Países Por Sus Escenas Explícitas, Esta Road Movie Hot Promete Ser La Cinta Más Polémica Del Festival.
Para Conseguir La Mejor Taza De Café Posible Decántate Por Un Specialty Coffee Fair Trade Y De Agricultura Ecológica.
Estuvo Durante Un Tiempo A Tiempo Parcial, Pero Ahora Trabaja Como Head Hunter Full Time.
Para Una Date Night Foodie, Te Recomendamos El Nuevo Local Del Cocinero Lorenzo Romero, Aunque Para Conseguir Mesa Es Imprescindible Reservar.
Falsificó Los Papeles Y La Policía Acabó Deteniéndole En El Control De Aduana, Cuando Intentó Cruzar La Frontera Con Una Green Card Fake.
BURPEES PARA PERDER KILOS SIN SALIR DE CASA;;;;
COOL, CÓMODA Y VERSÁTIL: LA GABARDINA QUE ESTÁ DE MODA ESTA TEMPORADA;;;;
PIPELINE DE CANALIZACIÓN DE DATOS DE CÓDIGO ABIERTO PARA ALMACENAR Y EXTRAER INFORMACIÓN;EXTRAER
DEALER DE ESTUPEFACIENTES DETENIDO EN UNA OPERACIÓN ANTIDROGA;DETENIDO
EYELINER A TODO COLOR PARA PARA UN VERANO FANTÁSTICO;;;;
"FRAME DE LA NUEVA SERIE ""BIG LITTLE LIES"" DE NETFLIX";BIG LITTLE LIES
HATE, FALTA DE PRIVACIDAD Y CIBERDELINCUENCIA: LA CARA OCULTA DE LAS REDES;;;;
HOODIE CON CAPUCHA, BOTINES Y GAFAS DE PASTA CONFORMAN EL ATUENDO QUE LE HAN HECHO FAMOSO.;;;;
REVIVAL DE LOS OCHENTA EN LOS CARNAVALES DE ESTE AÑO;;;;
GAMER, MUJER Y HOMOSEXUAL: LA NUEVA ESTRELLA DEL PARTIDO REPUBLICANO;;;;
BAD HAIR DAY: UN MAL DÍA DE ESTILISMO LO TIENE CUALQUIERA;;;;
CURTAIN FRINGE: EL FLEQUILLO QUE CREA TENDENCIA ESTA TEMPORADA;;;;
EYE LINER A TODO COLOR PARA PARA UN VERANO FANTÁSTICO;;;;
GOLDEN VISA SOLO PARA MILLONARIOS: ASÍ SE REPARTEN LOS VISADOS DE ORO ENTRE EXTRANJEROS;;;;
HOME CINEMA Y PALOMITAS PARA DISFRUTAR DEL CINE SIN SALIR DE CASA;;;;
"SEASON FINALE DE INFARTO DE ""PRISION BREAK"" ESTA NOCHE A LAS 21H EN CARTOON NETWORK";PRISION BREAK
GOAL AVERAGE AL LÍMITE PARA EL DESEMPATAR ENTRE EL VALENCIA Y EL LIVERPOOL;;;;
MEDAL RACE ENTRE NIGERIA Y POLONIA POR LA PLATA EN ATLETISMO;;;;
OIL FREE Y SIN PARABENOS: ASÍ SON LAS CREMAS SOLARES QUE RECOMIENDAN LOS DERMATÓLOGOS;;;;
¿OPEN SOURCE O CÓDIGO PROPRIETARIO?;OPEN;SOURCE;PROPRIETARIO
LAS SENTADILLAS, LAS FLEXIONES O LOS BURPEES SON MÉTODOS MUY EFECTIVOS PARA PERDER PESO EN UN PERIODO CORTO DE TIEMPO.;;;;
ESTOS ZAPATOS DE PLATAFORMA YA SEA EN NEGRO O EN MODELOS ESTAMPADOS RESULTAN CÓMODOS, ELEGANTES Y MUY COOL.;;;;
LA EMPRESA CUENTA YA CON UN PIPELINE DE 2 GW EN ALEMANIA Y ESTÁ AVANZANDO EN LA CONTRATACIÓN DE UN EQUIPO LOCAL PARA LA SEDE DE LIECHTENSTEIN;;;;
NO ES RARO QUE EN LOS FESTIVALES TE DEN DIRECTAMENTE EL TELÉFONO DEL DEALER DE CONFIANZA;;;;
PARA LA OCASIÓN LUCIÓ UN MAQUILLAJE MUY NATURAL, CON EYELINER MARRÓN Y SIN PESTAÑAS POSTIZAS;;;;
EN EL REVISIONADO A CÁMARA LENTA ES POSIBLE APRECIAR EL FRAME EXACTO EN EL QUE EL ACTOR PIERDE EL HILO;POSIBLE
LAS ARTISTAS DENUNCIAN LAS CAMPAÑAS DE HATE Y ACOSO MACHISTA ORGANIZADO QUE RECIBEN;;;;
EL ESTILISMO DESENFADADO DE HOODIE Y CAMISETA DEPORTIVA SON SU MARCA INCONFUDIBLE Y AHORA LO HA CONVERTIDO EN UNA LÍNEA DE MODA MUY RENTABLE;;;;
LAS HOMBRERAS, LOS CARDADOS IMPOSIBLES Y LA MÚSICA DE MECANO CONFIRMAN QUE ESTAMOS INMERSOS EN EL ENÉSIMO REVIVAL DE LOS AÑOS OCHENTA;;;;
LAS DESCOMUNALES SILLAS Y LOS FOCOS CON LUZ AZUL TENUE SON PARTE DE LA ESTÉTICA GAMER QUE TANTO HA POPULARIZADO EL CONOCIDO IBAI LLANOS;;;;
SIN QUE SIRVA DE PRECEDENTE Y SOLO PORQUE SOMOS ENTUSIASTAS DE SUS ARRIESGADOS PEINADOS, LE PERDONAMOS AL ACTOR EL BAD HAIR DAY CON EL QUE NOS SORPRENDIÓ DURANTE LA ALFOMBRA ROJA;ALFOMBRA
CORTADO POR ENCIMA DE LAS CEJAS Y LADEADO HACIA LAS SIENES, EL CURTAIN FRINGE VUELVE A TRIUNFAR ESTE AÑO;;;;
PARA LA OCASIÓN LUCIÓ UN MAQUILLAJE MUY NATURAL, CON EYE LINER MARRÓN Y SIN PESTAÑAS POSTIZAS;;;;
EL GOBIERNO PONE CONTRA LAS CUERDAS A LAS INMOBILIARIAS DE LUJO POR LA PROHIBICIÓN DE LAS GOLDEN VISA.;;;;
DISFRUTAR DEL CINE EN CASA ES POSIBLE CON UN BUEN APARATO DE HOME CINEMA O UN PROYECTOR DE GRAN CALIDAD;POSIBLE
NINGUNO DE LOS ACTORES QUISO REVELAR QUÉ SUELDO RECIBIERON POR PARTICIPAR EN LA SEASON FINALE DE LA SERIE.;;;;
A FALTA DE TRES JORNADAS PARA EL FINAL DEL CAMPEONATO, LOS SIETE PUNTOS DE VENTAJA MÁS EL GOAL AVERAGE PARECEN SUFICIENTES PARA GARANTIZAR LA VICTORIA DE LOS ROJIBLANCOS;;;;
AMBOS PAÍSES SE HAN VISTO ENVUELTOS EN UNA MEDAL RACE DE INFARTO, CUYO DESENLACE SE RESOLVERÁ EN LA SEMIFINAL DEL PRÓXIMO JUEVES;;;;
LAS PIELES GRASAS Y CON TENDENCIA ACNEICA PREFERIRÁN DECANTARSE POR LA FÓRMULA OIL FREE DEL PRODUCTO;;;;
LOS INVESTIGADORES CRITICAN LA OPACIDAD DE ESTA TECNOLOGÍA Y RECLAMAN MODELOS OPEN SOURCE QUE PUEDAN SER UTILIZADOS SIN COSTE Y AUDITADOS DE MANERA TRANSPARENTE.;;;;
HEALTHY FOOD FÁCIL Y ASEQUIBLE PARA PERDER LOS KILOS DE NAVIDAD;;;;
BUDDY MOVIE Y PALOMITAS PARA DISFRUTAR DEL CINE SIN SALIR DE CASA;;;;
EARLY ADOPTER, MUJER Y HOMOSEXUAL: LA NUEVA ESTRELLA DEL PARTIDO REPUBLICANO;;;;
GARDEN PARTY A LAS 7 AMENIZADA POR UNA BANDA DE MÚSICA;;;;
GUILTY PLEASURES SETENTEROS PARA ANIMAR TUS LISTAS DE SPOTIFY;;;;
JOINT VENTURES DE TODO EL MUNDO SE REÚNEN ESTOS DÍAS EN MADRID PARA LA MAYOR FERIA MUNDIAL DE LA INDUSTRIA;;;;
REVENGE DRESS: EL VESTIDO DE LADY DI QUE HIZO HISTORIA Y ROBÓ EL CORAZÓN DEL PUEBLO BRITÁNICO;;;;
SENSITIVITY READER ADEMÁS DE ACTRIZ, SMITH SE GANÓ EL APLAUSO DE LA CRÍTICA CON SU PRIMERA PELÍCULA;;;;
SMASH BURGER VEGANA Y CON UN PUNTO PICANTE;;;;
TIE BREAK ENTRE NADAL Y FEDERER EN UN DESEMPATE DE INFARTO;;;;
LOS AMANTES DEL HEALTHY FOOD ENCONTRARÁN OPCIONES SALUDABLES EN LOS LINEALES DE LA TIENDA;;;;
NADA COMO UNA NOCHE DE MANTITA, SOFÁ Y UNA BUENA BUDDY MOVIE PARA IRSE A DORMIR CON UNA SONRISA.;;;;
FRENTE AL CONSUMIDOR TRADICIONAL MÁS CONSERVADOR, EL EARLY ADOPTER ES EL CLIENTE ÁVIDO POR HACERSE CON EL ÚLTIMO CACHARRITO DEL MERCADO;;;;
LOS FAROLILLOS DE PAPEL Y LAS FLORES SON ELEMENTOS DECORATIVOS QUE NO PUEDEN FALTAR EN UNA GARDEN PARTY VERANIEGA.;;;;
ESOS TEMAZOS MAMARRACHOS QUE TE AVERGÜENZAN PERO QUE NO PUEDES DEJAR DE ESCUCHAR CONFECCIONAN LO QUE SE CONOCE COMO GUILTY PLEASURES.;;;;
EMPRESAS DEL SECTOR CONFIRMAN LA FUSIÓN DE AMBAS COMPAÑÍAS, LO QUE SUPONDRÍA UN HITO EN LA HISTORIA DE LAS JOINT VENTURES EN LUXEMBURGO.;;;;
ALGUNAS VOCES ALERTAN DE QUE CONSIDERAR EL REVENGE DRESS COMO ALGO MACHISTA BANALIZA EL GRAN PODER QUE TIENE LA MODA COMO LENGUAJE Y SISTEMA DE COMUNICACIÓN.;;;;
LA LABOR DEL SENSITIVITY READER NO ES OTRA QUE LA DE DETECTAR POSIBLES SESGOS, PREJUICIOS O ESTEREOTIPOS INDESEADOS EN EL TEXTO EN CUESTIÓN.;;;;
CON SU CEBOLLITA CRUJIENTE, SU PAN ESPONJOSO Y UNA SALSA LIGERAMENTE AGRIDULCE, A QUIÉN NO SE LE HARÍA LA BOCA AGUA CON UNA SMASH BURGER COMO ESTA?;;;;
HUBO QUE ESPERAR AL TIE BREAK PARA VER A LA TENISTA REMONTAR Y DESPLEGAR EL JUEGO OFENSIVO E IMPLACABLE AL QUE NOS TIENE ACOSTUMBRADOS.;;;;
BLUE COLLAR, MUJER Y HOMOSEXUAL: LA NUEVA ESTRELLA DEL PARTIDO REPUBLICANO;;;;
CASUAL LOOKS CON BUFANDA Y GUANTES PARA TRIUNFAR ESTA TEMPORADA;;;;
DAD JEAN SIN BOLSILLOS Y DE TIRO ALTO: LA NUEVA MODA EN LA PASARELA DE MILÁN;;;;
DATA SCIENTIST, INGENIERO DE INTELIGENCIA ARTIFICIAL Y TÉCNICO EN VISUALIZACIÓN DE DATOS SON LAS CARRERAS MÁS DEMANDADAS AHORA MISMO EN ESPAÑA;;;;
ESCAPE ROOMS DE TODO EL MUNDO SE REÚNEN ESTOS DÍAS EN MADRID PARA LA MAYOR FERIA MUNDIAL DE LA INDUSTRIA;;;;
GLUTEN FREE Y SIN AZÚCAR: EL DESAYUNO SALUDABLE QUE RECOMIENDAN LOS DIETISTAS;;;;
LATE NIGHTS Y ACTUALIDAD SON LOS GÉNEROS QUE COPAN LA PROGRAMACIÓN TELEVISIVA;;;;
PERSONAL TRAINER ADEMÁS DE ACTRIZ, SMITH SE GANÓ EL APLAUSO DE LA CRÍTICA CON SU PRIMERA PELÍCULA;;;;
RED CARPET PASADA POR AGUA EN LA QUINCUAGÉSIMA TERCERA EDICIÓN DE LOS PREMIOS DE LA ACADEMIA;;;;
TIME LAPSE DE LA PUESTA DE SOL CAPTADO DESDE LA MARISMA DE DOÑANA;CAPTADO
SU TRABAJO COMO DATA SCIENTIST HA DADO TAMBIÉN FRUTOS EN EL SECTOR FARMACÉUTICO, DONDE SUS MODELOS SOBRE PLEGAMIENTO DE PROTEÍNAS HAN DADO PIE A UNA NUEVA GENERACIÓN DE FÁRMACOS;;;;
