"""Burpees"" para perder kilos sin salir de casa";Burpees
"""Joint Ventures"" de todo el mundo se reúnen estos días en Madrid para la mayor feria mundial de la industria";Joint Ventures
"""Revenge Dress"": el vestido de Lady Di que hizo historia y robó el corazón del pueblo británico";Revenge Dress
"""Sensitivity Reader"" además de actriz, Smith se ganó el aplauso de la crítica con su primera película";Sensitivity Reader
"""Smash Burger"" vegana y con un punto picante";Smash Burger
"""Tie Break"" entre Nadal y Federer en un desempate de infarto";Tie Break
"Los amantes del ""Healthy Food"" encontrarán opciones saludables en los lineales de la tienda";Healthy Food
"Nada como una noche de mantita, sofá y una buena ""Buddy Movie"" para irse a dormir con una sonrisa.";Buddy Movie
"Frente al consumidor tradicional más conservador, el ""Early Adopter"" es el cliente ávido por hacerse con el último cacharrito del mercado";Early Adopter
"Los farolillos de papel y las flores son elementos decorativos que no pueden faltar en una ""Garden Party"" veraniega.";Garden Party
"Esos temazos mamarrachos que te avergüenzan pero que no puedes dejar de escuchar confeccionan lo que se conoce como ""Guilty Pleasures"".";Guilty Pleasures
"Empresas del sector confirman la fusión de ambas compañías, lo que supondría un hito en la historia de las ""Joint Ventures"" en Luxemburgo.";Joint Ventures
"Algunas voces alertan de que considerar el ""Revenge Dress"" como algo machista banaliza el gran poder que tiene la moda como lenguaje y sistema de comunicación.";Revenge Dress
"La labor del ""Sensitivity Reader"" no es otra que la de detectar posibles sesgos, prejuicios o estereotipos indeseados en el texto en cuestión.";Sensitivity Reader
"Con su cebollita crujiente, su pan esponjoso y una salsa ligeramente agridulce, a quién no se le haría la boca agua con una ""Smash Burger"" como esta?";Smash Burger
"Hubo que esperar al ""Tie Break"" para ver a la tenista remontar y desplegar el juego ofensivo e implacable al que nos tiene acostumbrados.";Tie Break
"""Blue Collar"", mujer y homosexual: la nueva estrella del partido republicano";Blue Collar
"""Casual Looks"" con bufanda y guantes para triunfar esta temporada";Casual Looks
"""Dad Jean"" sin bolsillos y de tiro alto: la nueva moda en la pasarela de Milán";Dad Jean
"""Data Scientist"", ingeniero de inteligencia artificial y técnico en visualización de datos son las carreras más demandadas ahora mismo en España";Data Scientist
"""Escape Rooms"" de todo el mundo se reúnen estos días en Madrid para la mayor feria mundial de la industria";Escape Rooms
"""Gluten Free"" y sin azúcar: el desayuno saludable que recomiendan los dietistas";Gluten Free
"""Late Nights"" y actualidad son los géneros que copan la programación televisiva";Late Nights
"""Personal Trainer"" además de actriz, Smith se ganó el aplauso de la crítica con su primera película";Personal Trainer
"""Red Carpet"" pasada por agua en la quincuagésima tercera edición de los premios de la Academia";Red Carpet
"""Time Lapse"" de la puesta de sol captado desde la marisma de Doñana";Time Lapse
"Su trabajo como ""Data Scientist"" ha dado también frutos en el sector farmacéutico, donde sus modelos sobre plegamiento de proteínas han dado pie a una nueva generación de fármacos";Data Scientist
"Tacones y vestidazos dejan hueco a ""Casual Looks"" más alegres y festivos, donde hasta el chándal tiene protagonismo.";Casual Looks
"Un ""Dad Jean"" es el vaquero de corte amplio y holgado que esperaríamos encontrar en el armario de un señor de más de 50 años y poco gusto por la moda.";Dad Jean
"Los trabajadores ""Blue Collar"" son el principal granero de votos del partido nacionalista, donde cosecha porcentajes de intención de voto de hasta el 50";Blue Collar
"Para los escépticos de las discotecas o de los planes al aire libre, las ""Escape Rooms"" son una excelente opción para cumpleaños y celebraciones grupales diferentes.";Escape Rooms
"Los celíacos encontrarán en la carta apetitosas raciones ""Gluten Free"" para escoger.";Gluten Free
"La directora se ha dejado ver estos días como invitada en tertulias y diversos ""Late Nights"", donde ha contado algunos detalles del proceso creativo detrás de su primer documental.";Late Nights
"Solo, en clase colectiva o con ""Personal Trainer"", cualquier forma de ejercicio mejora la salud cardiovascular y la función genitourinaria.";Personal Trainer
"Ídolos, cantantes, actores, publicistas y hasta un cirujano en la ""Red Carpet"" más variopinta y estrafalaria que hemos visto en mucho tiempo.";Red Carpet
"Requiere paciencia, buen equipamiento técnico y que la meteorología esté de nuestra parte, pero los resultados del ""Time Lapse"" merecen la pena y crearán un recuerdo espectacular para toda la vida.";Time Lapse
"""Trendsetter"", mujer y homosexual: la nueva estrella del partido republicano";Trendsetter
"""Cupcakes"" sin azúcar pero con todo el sabor";Cupcakes
"""Oversize"", cómoda y versátil: la gabardina está de moda esta temporada";Oversize
"""Reboot"" del clásico setentero esta noche en TVE";TVE;Reboot
"""Sharenting"": cuando la vida de los hijos se convierte en negocio";Sharenting
"""Skyline"" de Nueva York en película de Woody Allen ""Manhattan""";Skyline;Manhattan
"""Spoilers"" del episodio siete a continuación";Spoilers
"""Streamer"", ingeniero de inteligencia artificial y técnico en visualización de datos son las carreras más demandadas ahora mismo en España";Streamer
"""Afterparty"" hasta el amanecer tras la gala de los premios de la Academia";Afterparty
"""Cliffhanger"" de infarto en ""Prision Break"" esta noche a las 21h en Cartoon Network";Cliffhanger;Prision Break
"""Beauty Expert"", ingeniero de inteligencia artificial y técnico en visualización de datos son las carreras más demandadas ahora mismo en España";Beauty Expert
"""Fact Checkers"" confirman que la cifra aportada por el ministerio no es correcta y solicitan más información a la fiscalía";Fact Checkers
"""Fast Fashion"": un problema de consumismo que afecta al medio ambiente";Fast Fashion
"""Girl Bands"" y solistas se suman a la campaña para reclamar mayor presencia femenina en los festivales de música";Girl Bands
"""Glass Skin"": cómo conseguir el efecto piel de cristal que lucen las famosas";Glass Skin
"""Jumping Jacks"" para perder kilos sin salir de casa";Jumping Jacks
"""King Size"" y viscoelástico: el colchón que tu espalda necesita";King Size
"""Talk Shows"" y actualidad son los géneros que copan la programación televisiva";Talk Shows
"""Ugly Shoes"" a todo color para para un verano fantástico";Ugly Shoes
"""Wedding Planners"" de todo el mundo se reúnen estos días en Madrid para la mayor feria mundial de la industria";Wedding Planners
"Mariano Rajoy, el nuevo ""Trendsetter"" que agotó el abrigo que ha llevado en Washington DC.";DC;Trendsetter
"Los ""Cupcakes"" son como magdalenas hipertrofiadas recubiertas por toneladas de azúcar y decoradas con todo tipo de fantasías hechas a golpe de colorante alimentario.";Cupcakes
"No debemos subestimar las posibilidades de las prendas ""Oversize"" para aportar un toque sofisticado y moderno a nuestra indumentaria.";Oversize
"El ""Reboot"" de la serie no se prevé para el próximo otoño, pero los fanáticos de la saga ya han comenzado a calentar motores.";Reboot
"La madre ha sido acusada en numeriosas ocasiones de exponer a la menor en redes sociales en un caso claro de ""Sharenting"".";Sharenting
"El perfil de la Almudena y del Palacio Real vistos desde el otro lado del río Manzanares perfilan la imagen del clásico ""Skyline"" madrileño.";Skyline
"Las horas posteriores al estreno del capítulo son un campo de minas, porque es fácil tropezar involuntariamente con mensajes de desaprensivos llenos de ""Spoilers"" y acabar comiéndose alguno.";Spoilers
"En la ""Afterparty"" del evento pudimos ver a algunas de las caras más conocidas del universo cinematográfico";Afterparty
"El capítulo terminó con un ""Cliffhanger"" inesperado que deja la trama en el aire";Cliffhanger
"El ""Streamer"" ha negado las acusaciones que señalan que hizo publicidad encubierta, algo que la agencia europea condena con multas de hasta 50000 euros.";Streamer
"La cobertura del debate electoral se hará con un ejército de ""Fact Checkers"" que se ocuparán de contrastar los datos aportados por los candidatos durante el programa.";Fact Checkers
"El problema de la ""Fast Fashion"" es triple: consume recursos desmesuradamente, produce toneladas de basura de difícil reciclaje y fomenta la explotación laboral de la industria textil.";Fast Fashion
"En los noventa asistimos a un auge de de presencia femenina en el mundo de la música, tanto solistas como Tracy Chapman o ""Girl Bands"" como las Spice Girls.";Girl Bands
"Con los productos adecuados y una rutina de cuidado de la piel que seguiremos estrictamente, podemos lograr el aspecto ""Glass Skin"" o piel de cristal.";Glass Skin
"Las sentadillas, las flexiones o los ""Jumping Jacks"" son métodos muy efectivos para perder peso en un periodo corto de tiempo.";Jumping Jacks
"Las tiendas de colchones confirman la tendencia creciente de las camas grandes; la tradicional cama de 1, 35 ha sido desplazada por el tamaño ""King Size"" estadounidense, más propio de un hotel de lujo que de la típica casa española.";King Size
"La directora se ha dejado ver estos días como invitada en tertulias y diversos ""Talk Shows"", donde ha contado algunos detalles del proceso creativo detrás de su primer documental.";Talk Shows
"Feos pero distinguidos, los ""Ugly Shoes"" que lució Nicole Kidman han agotado existencias en apenas unos días.";Ugly Shoes
"Si la avalancha de tareas que conlleva organizar una boda reservar un sitio, elegir menú, encargar las flores, contratar una orquesta te abruman, debes saber que las ""Wedding Planners"" pueden ser tu solución.";Wedding Planners
"Puedes contratar una ""Beauty Expert"" y disfrutar del conocimiento para optimizar vuestras rutinas sin salir de casa.";Beauty Expert
"En Toronto habrá un ""Fan Festival"" de 3000 personas, que se reunirán para seguir el Barça Madrid";Fan Festival
"Un ""Fatal Error"" ocurre típicamente cuando el programa intenta dividir por cero";Fatal Error
"Durante su carrera profesional, también ha sido socio y director general de Ikea, ""Global Director"" de Apple y director de Comunicación de Basket Market.";Global Director
"En el ""Me Time"" nosotras debemos ser la prioridad, ha de ser placentero y hemos de poder disfrutarlo sin interrupciones";Me Time
"Los defensores del ""Natural Time"" proponen distribuir el calendario en 13 meses de 28 días, lo que hace un total de 364 días.";Natural Time
"El concurso presentado por Aitor Albizua se ha consolidado en el ""Prime Time"" de Telecinco gracias a su participante estrella, un muchacho que está deslumbrando a los espectadores con su rapidez a la hora de resolver operaciones matemáticas.";Prime Time
"Las trabas burocráticas o ""Red Tape"" que asolan su administración impiden que el flujo financiero de la UE abarque proyectos estratégicos para la reconversión del modelo productivo sueco";UE;Red Tape
"Greensmaniac, el ""Salad Bar"" de moda aterriza en Barcelona";Salad Bar
"De hecho, lo que busca a través de sus ""Social Media"" es lograr un contacto real y directo con sus seguidores.";Social Media
"La reina Letizia ha escogido un conjunto ""Total Red"" para la boda de los príncipes de de Holanda";Total Red
"Si por el contrario tenemos la piel seca o deshidratada, es aconsejable elegir un ""Primer"" de efecto hidratante.";Primer
"Receta de ""Pie"" de limón paso a paso y sin horno";Pie
"Dragados pone a la venta su antigua sede central en Barcelona para vivienda ""Prime""";Prime
"Pero si quieres aprovechar las rebajas, te proponemos un listado de ""Gadgets"" ""Beauty"" para sacarle todo el partido a los descuentos";Gadgets;Beauty
"Acostumbrados a verla con autendos imposibles y maquillajes muy recargados, la modelo nos ha sorprendido con un ""Look"" ""Effortless"" sencillo y natural que le quita años y muestra su cara más informal.";Look;Effortless
"La agencia reivindica la publicidad en medios clásicos como la radio y la televisión y desaconseja fiarlo todo a campañas de ""Marketing"" ""Online"".";Marketing;Online
"Eduardo Noriega se ha hecho con el título de ""hombre mejor vestido de la velada"" gracias a su ""Trench"" ""Oversize"" con mocasines a conjunto.";Trench;Oversize
"Tras años en la industria de los videojuegos, dio un giro radical a su carrera y ahora trabaja como ""Coach"" ""Wellness"" asesorando a trabajadores quemados y personas en busca del bienestar físico y emocional";Coach;Wellness
"La película es un ""Thriller"" ""Queer"" con esteroides, una crítica a todos los mensajes meritocráticos y de filosofía barata con los que nos inundan a diario";Thriller;Queer
"Birkenstock, la marca que reafirma la tendencia de las ""Sneakers"" ""Chunky""";Sneakers;Chunky
"Si el pincho USB convencional te da problemas, puedes probar con un ""Pendrive"" ""Smart"", que goza de conectividad autónoma y no necesita configuración externa.";USB;Pendrive;Smart
"Una hidratación con los tratamientos reafirmantes adecuados es la base para conseguir un ""Makeup"" ""Flawless"" y juvenil.";Makeup;Flawless
"Aunque han fijado un ""Dresscode"" ""Sporty"", es ""importante saber a dónde se viene, no puede presentarse uno en pijama"", afirma el anfitrión.";Dresscode;Sporty
"La cadena ha popularizado los ""Poke Bowls"" ""Healthy"" que ahora vemos por toda la ciudad.";Poke Bowls;Healthy
"La actriz lució un ""Look"" ""Total Black"" en el estreno de la película";Look;Total Black
"Una visita a Zara o a H M nos puede apañar un ""Outfit"" ""Low Cost"" con el que apañar la temporada de bodas que se avecina.";Outfit;Low Cost
"Receta para preparar una ""Carrot Cake"" ""Vegan Friendly""";Carrot Cake;Vegan Friendly
"Esta temporada triunfa el estilo noventero, como las chaquetas vaqueras, los ""Leggings"" ""Animal Print"" o los estampados imposibles.";Leggings;Animal Print
"Censurada en varios países por sus escenas explícitas, esta ""Road Movie"" ""Hot"" promete ser la cinta más polémica del festival.";Road Movie;Hot
"Para conseguir la mejor taza de café posible decántate por un ""Specialty Coffee"" ""Fair Trade"" y de agricultura ecológica.";Specialty Coffee;Fair Trade
"Estuvo durante un tiempo a tiempo parcial, pero ahora trabaja como ""Head Hunter"" ""Full Time"".";Head Hunter;Full Time
"Para una ""Date Night"" ""Foodie"", te recomendamos el nuevo local del cocinero Lorenzo Romero, aunque para conseguir mesa es imprescindible reservar.";Date Night;Foodie
"Falsificó los papeles y la policía acabó deteniéndole en el control de aduana, cuando intentó cruzar la frontera con una ""Green Card"" ""Fake"".";Green Card;Fake
"""BURPEES"" para perder kilos sin salir de casa";BURPEES
"""COOL"", cómoda y versátil: la gabardina que está de moda esta temporada";COOL
"""PIPELINE"" de canalización de datos de código abierto para almacenar y extraer información";PIPELINE
"""DEALER"" de estupefacientes detenido en una operación antidroga";DEALER
"""EYELINER"" a todo color para para un verano fantástico";EYELINER
"""FRAME"" de la nueva serie ""Big little lies"" de Netflix";FRAME;Big little lies
"""HATE"", falta de privacidad y ciberdelincuencia: la cara oculta de las redes";HATE
"""HOODIE"" con capucha, botines y gafas de pasta conforman el atuendo que le han hecho famoso.";HOODIE
"""REVIVAL"" de los ochenta en los carnavales de este año";REVIVAL
"""GAMER"", mujer y homosexual: la nueva estrella del partido republicano";GAMER
"""BAD HAIR DAY"": un mal día de estilismo lo tiene cualquiera";BAD HAIR DAY
"""CURTAIN FRINGE"": el flequillo que crea tendencia esta temporada";CURTAIN FRINGE
"""EYE LINER"" a todo color para para un verano fantástico";EYE LINER
"""GOLDEN VISA"" solo para millonarios: así se reparten los visados de oro entre extranjeros";GOLDEN VISA
"""HOME CINEMA"" y palomitas para disfrutar del cine sin salir de casa";HOME CINEMA
"""SEASON FINALE"" de infarto de ""Prision Break"" esta noche a las 21h en Cartoon Network";SEASON FINALE;Prision Break
"""GOAL AVERAGE"" al límite para el desempatar entre el Valencia y el Liverpool";GOAL AVERAGE
"""MEDAL RACE"" entre Nigeria y Polonia por la plata en atletismo";MEDAL RACE
"""OIL FREE"" y sin parabenos: así son las cremas solares que recomiendan los dermatólogos";OIL FREE
"¿""OPEN SOURCE"" o código proprietario?";OPEN SOURCE
"Las sentadillas, las flexiones o los ""BURPEES"" son métodos muy efectivos para perder peso en un periodo corto de tiempo.";BURPEES
"Estos zapatos de plataforma ya sea en negro o en modelos estampados resultan cómodos, elegantes y muy ""COOL"".";COOL
"La empresa cuenta ya con un ""PIPELINE"" de 2 GW en Alemania y está avanzando en la contratación de un equipo local para la sede de Liechtenstein";GW;PIPELINE
"No es raro que en los festivales te den directamente el teléfono del ""DEALER"" de confianza";DEALER
"Para la ocasión lució un maquillaje muy natural, con ""EYELINER"" marrón y sin pestañas postizas";EYELINER
"En el revisionado a cámara lenta es posible apreciar el ""FRAME"" exacto en el que el actor pierde el hilo";FRAME
"Las artistas denuncian las campañas de ""HATE"" y acoso machista organizado que reciben";HATE
"El estilismo desenfadado de ""HOODIE"" y camiseta deportiva son su marca inconfudible y ahora lo ha convertido en una línea de moda muy rentable";HOODIE
"Las hombreras, los cardados imposibles y la música de Mecano confirman que estamos inmersos en el enésimo ""REVIVAL"" de los años ochenta";REVIVAL
"Las descomunales sillas y los focos con luz azul tenue son parte de la estética ""GAMER"" que tanto ha popularizado el conocido Ibai Llanos";GAMER
"Sin que sirva de precedente y solo porque somos entusiastas de sus arriesgados peinados, le perdonamos al actor el ""BAD HAIR DAY"" con el que nos sorprendió durante la alfombra roja";BAD HAIR DAY
"Cortado por encima de las cejas y ladeado hacia las sienes, el ""CURTAIN FRINGE"" vuelve a triunfar este año";CURTAIN FRINGE
"Para la ocasión lució un maquillaje muy natural, con ""EYE LINER"" marrón y sin pestañas postizas";EYE LINER
"El gobierno pone contra las cuerdas a las inmobiliarias de lujo por la prohibición de las ""GOLDEN VISA"".";GOLDEN VISA
"Disfrutar del cine en casa es posible con un buen aparato de ""HOME CINEMA"" o un proyector de gran calidad";HOME CINEMA
"Ninguno de los actores quiso revelar qué sueldo recibieron por participar en la ""SEASON FINALE"" de la serie.";SEASON FINALE
"A falta de tres jornadas para el final del campeonato, los siete puntos de ventaja más el ""GOAL AVERAGE"" parecen suficientes para garantizar la victoria de los rojiblancos";GOAL AVERAGE
"Ambos países se han visto envueltos en una ""MEDAL RACE"" de infarto, cuyo desenlace se resolverá en la semifinal del próximo jueves";MEDAL RACE
"Las pieles grasas y con tendencia acneica preferirán decantarse por la fórmula ""OIL FREE"" del producto";OIL FREE
"Los investigadores critican la opacidad de esta tecnología y reclaman modelos ""OPEN SOURCE"" que puedan ser utilizados sin coste y auditados de manera transparente.";OPEN SOURCE
"""HEALTHY FOOD"" fácil y asequible para perder los kilos de Navidad";HEALTHY FOOD
"""BUDDY MOVIE"" y palomitas para disfrutar del cine sin salir de casa";BUDDY MOVIE
"""EARLY ADOPTER"", mujer y homosexual: la nueva estrella del partido republicano";EARLY ADOPTER
"""GARDEN PARTY"" a las 7 amenizada por una banda de música";GARDEN PARTY
"""GUILTY PLEASURES"" setenteros para animar tus listas de Spotify";GUILTY PLEASURES
"""JOINT VENTURES"" de todo el mundo se reúnen estos días en Madrid para la mayor feria mundial de la industria";JOINT VENTURES
"""REVENGE DRESS"": el vestido de Lady Di que hizo historia y robó el corazón del pueblo británico";REVENGE DRESS
"""SENSITIVITY READER"" además de actriz, Smith se ganó el aplauso de la crítica con su primera película";SENSITIVITY READER
"""SMASH BURGER"" vegana y con un punto picante";SMASH BURGER
"""TIE BREAK"" entre Nadal y Federer en un desempate de infarto";TIE BREAK
"Los amantes del ""HEALTHY FOOD"" encontrarán opciones saludables en los lineales de la tienda";HEALTHY FOOD
"Nada como una noche de mantita, sofá y una buena ""BUDDY MOVIE"" para irse a dormir con una sonrisa.";BUDDY MOVIE
"Frente al consumidor tradicional más conservador, el ""EARLY ADOPTER"" es el cliente ávido por hacerse con el último cacharrito del mercado";EARLY ADOPTER
"Los farolillos de papel y las flores son elementos decorativos que no pueden faltar en una ""GARDEN PARTY"" veraniega.";GARDEN PARTY
"Esos temazos mamarrachos que te avergüenzan pero que no puedes dejar de escuchar confeccionan lo que se conoce como ""GUILTY PLEASURES"".";GUILTY PLEASURES
"Empresas del sector confirman la fusión de ambas compañías, lo que supondría un hito en la historia de las ""JOINT VENTURES"" en Luxemburgo.";JOINT VENTURES
"Algunas voces alertan de que considerar el ""REVENGE DRESS"" como algo machista banaliza el gran poder que tiene la moda como lenguaje y sistema de comunicación.";REVENGE DRESS
"La labor del ""SENSITIVITY READER"" no es otra que la de detectar posibles sesgos, prejuicios o estereotipos indeseados en el texto en cuestión.";SENSITIVITY READER
"Con su cebollita crujiente, su pan esponjoso y una salsa ligeramente agridulce, a quién no se le haría la boca agua con una ""SMASH BURGER"" como esta?";SMASH BURGER
"Hubo que esperar al ""TIE BREAK"" para ver a la tenista remontar y desplegar el juego ofensivo e implacable al que nos tiene acostumbrados.";TIE BREAK
"""BLUE COLLAR"", mujer y homosexual: la nueva estrella del partido republicano";BLUE COLLAR
"""CASUAL LOOKS"" con bufanda y guantes para triunfar esta temporada";CASUAL LOOKS
"""DAD JEAN"" sin bolsillos y de tiro alto: la nueva moda en la pasarela de Milán";DAD JEAN
"""DATA SCIENTIST"", ingeniero de inteligencia artificial y técnico en visualización de datos son las carreras más demandadas ahora mismo en España";DATA SCIENTIST
"""ESCAPE ROOMS"" de todo el mundo se reúnen estos días en Madrid para la mayor feria mundial de la industria";ESCAPE ROOMS
"""GLUTEN FREE"" y sin azúcar: el desayuno saludable que recomiendan los dietistas";GLUTEN FREE
"""LATE NIGHTS"" y actualidad son los géneros que copan la programación televisiva";LATE NIGHTS
"""PERSONAL TRAINER"" además de actriz, Smith se ganó el aplauso de la crítica con su primera película";PERSONAL TRAINER
"""RED CARPET"" pasada por agua en la quincuagésima tercera edición de los premios de la Academia";RED CARPET
"""TIME LAPSE"" de la puesta de sol captado desde la marisma de Doñana";TIME LAPSE
"Su trabajo como ""DATA SCIENTIST"" ha dado también frutos en el sector farmacéutico, donde sus modelos sobre plegamiento de proteínas han dado pie a una nueva generación de fármacos";DATA SCIENTIST
"Tacones y vestidazos dejan hueco a ""CASUAL LOOKS"" más alegres y festivos, donde hasta el chándal tiene protagonismo.";CASUAL LOOKS
"Un ""DAD JEAN"" es el vaquero de corte amplio y holgado que esperaríamos encontrar en el armario de un señor de más de 50 años y poco gusto por la moda.";DAD JEAN
"Los trabajadores ""BLUE COLLAR"" son el principal granero de votos del partido nacionalista, donde cosecha porcentajes de intención de voto de hasta el 50";BLUE COLLAR
"Para los escépticos de las discotecas o de los planes al aire libre, las ""ESCAPE ROOMS"" son una excelente opción para cumpleaños y celebraciones grupales diferentes.";ESCAPE ROOMS
"Los celíacos encontrarán en la carta apetitosas raciones ""GLUTEN FREE"" para escoger.";GLUTEN FREE
"La directora se ha dejado ver estos días como invitada en tertulias y diversos ""LATE NIGHTS"", donde ha contado algunos detalles del proceso creativo detrás de su primer documental.";LATE NIGHTS
"Solo, en clase colectiva o con ""PERSONAL TRAINER"", cualquier forma de ejercicio mejora la salud cardiovascular y la función genitourinaria.";PERSONAL TRAINER
"Ídolos, cantantes, actores, publicistas y hasta un cirujano en la ""RED CARPET"" más variopinta y estrafalaria que hemos visto en mucho tiempo.";RED CARPET
"Requiere paciencia, buen equipamiento técnico y que la meteorología esté de nuestra parte, pero los resultados del ""TIME LAPSE"" merecen la pena y crearán un recuerdo espectacular para toda la vida.";TIME LAPSE
"""TRENDSETTER"", mujer y homosexual: la nueva estrella del partido republicano";TRENDSETTER
"""CUPCAKES"" sin azúcar pero con todo el sabor";CUPCAKES
"""OVERSIZE"", cómoda y versátil: la gabardina está de moda esta temporada";OVERSIZE
"""REBOOT"" del clásico setentero esta noche en TVE";TVE;REBOOT
"""SHARENTING"": cuando la vida de los hijos se convierte en negocio";SHARENTING
"""SKYLINE"" de Nueva York en película de Woody Allen ""Manhattan""";SKYLINE;Manhattan
"""SPOILERS"" del episodio siete a continuación";SPOILERS
"""STREAMER"", ingeniero de inteligencia artificial y técnico en visualización de datos son las carreras más demandadas ahora mismo en España";STREAMER
"""AFTERPARTY"" hasta el amanecer tras la gala de los premios de la Academia";AFTERPARTY
"""CLIFFHANGER"" de infarto en ""Prision Break"" esta noche a las 21h en Cartoon Network";CLIFFHANGER;Prision Break
"""BEAUTY EXPERT"", ingeniero de inteligencia artificial y técnico en visualización de datos son las carreras más demandadas ahora mismo en España";BEAUTY EXPERT
