"""Burpees"" para perder kilos sin salir de casa";;;;
"""Cliffhanger"" de infarto en ""Prision Break"" esta noche a las 21h en Cartoon Network";;;;
"""Beauty Expert"", ingeniero de inteligencia artificial y técnico en visualización de datos son las carreras más demandadas ahora mismo en España";;;;
"""Fact Checkers"" confirman que la cifra aportada por el ministerio no es correcta y solicitan más información a la fiscalía";;;;
"""Fast Fashion"": un problema de consumismo que afecta al medio ambiente";;;;
"""Girl Bands"" y solistas se suman a la campaña para reclamar mayor presencia femenina en los festivales de música";;;;
"""Glass Skin"": cómo conseguir el efecto piel de cristal que lucen las famosas";;;;
"""Jumping Jacks"" para perder kilos sin salir de casa";;;;
"""King Size"" y viscoelástico: el colchón que tu espalda necesita";;;;
"""Talk Shows"" y actualidad son los géneros que copan la programación televisiva";;;;
"""Ugly Shoes"" a todo color para para un verano fantástico";;;;
"""Wedding Planners"" de todo el mundo se reúnen estos días en Madrid para la mayor feria mundial de la industria";;;;
"Mariano Rajoy, el nuevo ""Trendsetter"" que agotó el abrigo que ha llevado en Washington DC.";Trendsetter
"Los ""Cupcakes"" son como magdalenas hipertrofiadas recubiertas por toneladas de azúcar y decoradas con todo tipo de fantasías hechas a golpe de colorante alimentario.";;;;
"No debemos subestimar las posibilidades de las prendas ""Oversize"" para aportar un toque sofisticado y moderno a nuestra indumentaria.";;;;
"El ""Reboot"" de la serie no se prevé para el próximo otoño, pero los fanáticos de la saga ya han comenzado a calentar motores.";;;;
"La madre ha sido acusada en numeriosas ocasiones de exponer a la menor en redes sociales en un caso claro de ""Sharenting"".";;;;
"El perfil de la Almudena y del Palacio Real vistos desde el otro lado del río Manzanares perfilan la imagen del clásico ""Skyline"" madrileño.";;;;
"Las horas posteriores al estreno del capítulo son un campo de minas, porque es fácil tropezar involuntariamente con mensajes de desaprensivos llenos de ""Spoilers"" y acabar comiéndose alguno.";;;;
"En la ""Afterparty"" del evento pudimos ver a algunas de las caras más conocidas del universo cinematográfico";;;;
"El capítulo terminó con un ""Cliffhanger"" inesperado que deja la trama en el aire";;;;
"El ""Streamer"" ha negado las acusaciones que señalan que hizo publicidad encubierta, algo que la agencia europea condena con multas de hasta 50000 euros.";;;;
"La cobertura del debate electoral se hará con un ejército de ""Fact Checkers"" que se ocuparán de contrastar los datos aportados por los candidatos durante el programa.";;;;
"El problema de la ""Fast Fashion"" es triple: consume recursos desmesuradamente, produce toneladas de basura de difícil reciclaje y fomenta la explotación laboral de la industria textil.";;;;
"En los noventa asistimos a un auge de de presencia femenina en el mundo de la música, tanto solistas como Tracy Chapman o ""Girl Bands"" como las Spice Girls.";;;;
"Con los productos adecuados y una rutina de cuidado de la piel que seguiremos estrictamente, podemos lograr el aspecto ""Glass Skin"" o piel de cristal.";;;;
"Las sentadillas, las flexiones o los ""Jumping Jacks"" son métodos muy efectivos para perder peso en un periodo corto de tiempo.";;;;
"Las tiendas de colchones confirman la tendencia creciente de las camas grandes; la tradicional cama de 1, 35 ha sido desplazada por el tamaño ""King Size"" estadounidense, más propio de un hotel de lujo que de la típica casa española.";;;;
"La directora se ha dejado ver estos días como invitada en tertulias y diversos ""Talk Shows"", donde ha contado algunos detalles del proceso creativo detrás de su primer documental.";;;;
"Feos pero distinguidos, los ""Ugly Shoes"" que lució Nicole Kidman han agotado existencias en apenas unos días.";;;;
"Si la avalancha de tareas que conlleva organizar una boda reservar un sitio, elegir menú, encargar las flores, contratar una orquesta te abruman, debes saber que las ""Wedding Planners"" pueden ser tu solución.";;;;
"Puedes contratar una ""Beauty Expert"" y disfrutar del conocimiento para optimizar vuestras rutinas sin salir de casa.";;;;
"En Toronto habrá un ""Fan Festival"" de 3000 personas, que se reunirán para seguir el Barça Madrid";;;;
"Un ""Fatal Error"" ocurre típicamente cuando el programa intenta dividir por cero";;;;
"Durante su carrera profesional, también ha sido socio y director general de Ikea, ""Global Director"" de Apple y director de Comunicación de Basket Market.";;;;
"En el ""Me Time"" nosotras debemos ser la prioridad, ha de ser placentero y hemos de poder disfrutarlo sin interrupciones";;;;
"Los defensores del ""Natural Time"" proponen distribuir el calendario en 13 meses de 28 días, lo que hace un total de 364 días.";;;;
"El concurso presentado por Aitor Albizua se ha consolidado en el ""Prime Time"" de Telecinco gracias a su participante estrella, un muchacho que está deslumbrando a los espectadores con su rapidez a la hora de resolver operaciones matemáticas.";;;;
"Las trabas burocráticas o ""Red Tape"" que asolan su administración impiden que el flujo financiero de la UE abarque proyectos estratégicos para la reconversión del modelo productivo sueco";;;;
"Greensmaniac, el ""Salad Bar"" de moda aterriza en Barcelona";Greensmaniac
"De hecho, lo que busca a través de sus ""Social Media"" es lograr un contacto real y directo con sus seguidores.";;;;
"La reina Letizia ha escogido un conjunto ""Total Red"" para la boda de los príncipes de de Holanda";;;;
"Si por el contrario tenemos la piel seca o deshidratada, es aconsejable elegir un ""Primer"" de efecto hidratante.";;;;
"Receta de ""Pie"" de limón paso a paso y sin horno";;;;
"Dragados pone a la venta su antigua sede central en Barcelona para vivienda ""Prime""";;;;
"Pero si quieres aprovechar las rebajas, te proponemos un listado de ""Gadgets"" ""Beauty"" para sacarle todo el partido a los descuentos";;;;
"Acostumbrados a verla con autendos imposibles y maquillajes muy recargados, la modelo nos ha sorprendido con un ""Look"" ""Effortless"" sencillo y natural que le quita años y muestra su cara más informal.";;;;
"La agencia reivindica la publicidad en medios clásicos como la radio y la televisión y desaconseja fiarlo todo a campañas de ""Marketing"" ""Online"".";;;;
"Eduardo Noriega se ha hecho con el título de ""hombre mejor vestido de la velada"" gracias a su ""Trench"" ""Oversize"" con mocasines a conjunto.";;;;
"Tras años en la industria de los videojuegos, dio un giro radical a su carrera y ahora trabaja como ""Coach"" ""Wellness"" asesorando a trabajadores quemados y personas en busca del bienestar físico y emocional";;;;
"La película es un ""Thriller"" ""Queer"" con esteroides, una crítica a todos los mensajes meritocráticos y de filosofía barata con los que nos inundan a diario";;;;
"Birkenstock, la marca que reafirma la tendencia de las ""Sneakers"" ""Chunky""";;;;
"Si el pincho USB convencional te da problemas, puedes probar con un ""Pendrive"" ""Smart"", que goza de conectividad autónoma y no necesita configuración externa.";;;;
"Una hidratación con los tratamientos reafirmantes adecuados es la base para conseguir un ""Makeup"" ""Flawless"" y juvenil.";;;;
"Aunque han fijado un ""Dresscode"" ""Sporty"", es ""importante saber a dónde se viene, no puede presentarse uno en pijama"", afirma el anfitrión.";;;;
"La cadena ha popularizado los ""Poke Bowls"" ""Healthy"" que ahora vemos por toda la ciudad.";;;;
"La actriz lució un ""Look"" ""Total Black"" en el estreno de la película";;;;
"Una visita a Zara o a H M nos puede apañar un ""Outfit"" ""Low Cost"" con el que apañar la temporada de bodas que se avecina.";;;;
"Receta para preparar una ""Carrot Cake"" ""Vegan Friendly""";;;;
"Esta temporada triunfa el estilo noventero, como las chaquetas vaqueras, los ""Leggings"" ""Animal Print"" o los estampados imposibles.";;;;
"Censurada en varios países por sus escenas explícitas, esta ""Road Movie"" ""Hot"" promete ser la cinta más polémica del festival.";;;;
"Para conseguir la mejor taza de café posible decántate por un ""Specialty Coffee"" ""Fair Trade"" y de agricultura ecológica.";;;;
"Estuvo durante un tiempo a tiempo parcial, pero ahora trabaja como ""Head Hunter"" ""Full Time"".";;;;
"Para una ""Date Night"" ""Foodie"", te recomendamos el nuevo local del cocinero Lorenzo Romero, aunque para conseguir mesa es imprescindible reservar.";;;;
"Falsificó los papeles y la policía acabó deteniéndole en el control de aduana, cuando intentó cruzar la frontera con una ""Green Card"" ""Fake"".";;;;
"""BURPEES"" para perder kilos sin salir de casa";;;;
"""COOL"", cómoda y versátil: la gabardina que está de moda esta temporada";;;;
"""PIPELINE"" de canalización de datos de código abierto para almacenar y extraer información";;;;
"""DEALER"" de estupefacientes detenido en una operación antidroga";;;;
"""EYELINER"" a todo color para para un verano fantástico";;;;
"""FRAME"" de la nueva serie ""Big little lies"" de Netflix";little
"""HATE"", falta de privacidad y ciberdelincuencia: la cara oculta de las redes";;;;
"""HOODIE"" con capucha, botines y gafas de pasta conforman el atuendo que le han hecho famoso.";;;;
"""REVIVAL"" de los ochenta en los carnavales de este año";;;;
"""GAMER"", mujer y homosexual: la nueva estrella del partido republicano";;;;
"""BAD HAIR DAY"": un mal día de estilismo lo tiene cualquiera";;;;
"""CURTAIN FRINGE"": el flequillo que crea tendencia esta temporada";;;;
"""EYE LINER"" a todo color para para un verano fantástico";;;;
"""GOLDEN VISA"" solo para millonarios: así se reparten los visados de oro entre extranjeros";;;;
"""HOME CINEMA"" y palomitas para disfrutar del cine sin salir de casa";;;;
"""SEASON FINALE"" de infarto de ""Prision Break"" esta noche a las 21h en Cartoon Network";;;;
"""GOAL AVERAGE"" al límite para el desempatar entre el Valencia y el Liverpool";AVERAGE
"""MEDAL RACE"" entre Nigeria y Polonia por la plata en atletismo";;;;
"""OIL FREE"" y sin parabenos: así son las cremas solares que recomiendan los dermatólogos";;;;
"¿""OPEN SOURCE"" o código proprietario?";;;;
"Las sentadillas, las flexiones o los ""BURPEES"" son métodos muy efectivos para perder peso en un periodo corto de tiempo.";;;;
"Estos zapatos de plataforma ya sea en negro o en modelos estampados resultan cómodos, elegantes y muy ""COOL"".";;;;
"La empresa cuenta ya con un ""PIPELINE"" de 2 GW en Alemania y está avanzando en la contratación de un equipo local para la sede de Liechtenstein";;;;
"No es raro que en los festivales te den directamente el teléfono del ""DEALER"" de confianza";;;;
"Para la ocasión lució un maquillaje muy natural, con ""EYELINER"" marrón y sin pestañas postizas";;;;
"En el revisionado a cámara lenta es posible apreciar el ""FRAME"" exacto en el que el actor pierde el hilo";;;;
"Las artistas denuncian las campañas de ""HATE"" y acoso machista organizado que reciben";;;;
"El estilismo desenfadado de ""HOODIE"" y camiseta deportiva son su marca inconfudible y ahora lo ha convertido en una línea de moda muy rentable";;;;
"Las hombreras, los cardados imposibles y la música de Mecano confirman que estamos inmersos en el enésimo ""REVIVAL"" de los años ochenta";;;;
"Las descomunales sillas y los focos con luz azul tenue son parte de la estética ""GAMER"" que tanto ha popularizado el conocido Ibai Llanos";;;;
"Sin que sirva de precedente y solo porque somos entusiastas de sus arriesgados peinados, le perdonamos al actor el ""BAD HAIR DAY"" con el que nos sorprendió durante la alfombra roja";;;;
"Cortado por encima de las cejas y ladeado hacia las sienes, el ""CURTAIN FRINGE"" vuelve a triunfar este año";;;;
"Para la ocasión lució un maquillaje muy natural, con ""EYE LINER"" marrón y sin pestañas postizas";;;;
"El gobierno pone contra las cuerdas a las inmobiliarias de lujo por la prohibición de las ""GOLDEN VISA"".";;;;
"Disfrutar del cine en casa es posible con un buen aparato de ""HOME CINEMA"" o un proyector de gran calidad";;;;
"Ninguno de los actores quiso revelar qué sueldo recibieron por participar en la ""SEASON FINALE"" de la serie.";;;;
"A falta de tres jornadas para el final del campeonato, los siete puntos de ventaja más el ""GOAL AVERAGE"" parecen suficientes para garantizar la victoria de los rojiblancos";AVERAGE
"Ambos países se han visto envueltos en una ""MEDAL RACE"" de infarto, cuyo desenlace se resolverá en la semifinal del próximo jueves";;;;
"Las pieles grasas y con tendencia acneica preferirán decantarse por la fórmula ""OIL FREE"" del producto";;;;
"Los investigadores critican la opacidad de esta tecnología y reclaman modelos ""OPEN SOURCE"" que puedan ser utilizados sin coste y auditados de manera transparente.";;;;
"""HEALTHY FOOD"" fácil y asequible para perder los kilos de Navidad";;;;
"""BUDDY MOVIE"" y palomitas para disfrutar del cine sin salir de casa";;;;
"""EARLY ADOPTER"", mujer y homosexual: la nueva estrella del partido republicano";;;;
"""GARDEN PARTY"" a las 7 amenizada por una banda de música";;;;
"""GUILTY PLEASURES"" setenteros para animar tus listas de Spotify";;;;
"""JOINT VENTURES"" de todo el mundo se reúnen estos días en Madrid para la mayor feria mundial de la industria";;;;
"""REVENGE DRESS"": el vestido de Lady Di que hizo historia y robó el corazón del pueblo británico";;;;
"""SENSITIVITY READER"" además de actriz, Smith se ganó el aplauso de la crítica con su primera película";;;;
"""SMASH BURGER"" vegana y con un punto picante";;;;
"""TIE BREAK"" entre Nadal y Federer en un desempate de infarto";;;;
"Los amantes del ""HEALTHY FOOD"" encontrarán opciones saludables en los lineales de la tienda";;;;
"Nada como una noche de mantita, sofá y una buena ""BUDDY MOVIE"" para irse a dormir con una sonrisa.";;;;
"Frente al consumidor tradicional más conservador, el ""EARLY ADOPTER"" es el cliente ávido por hacerse con el último cacharrito del mercado";;;;
"Los farolillos de papel y las flores son elementos decorativos que no pueden faltar en una ""GARDEN PARTY"" veraniega.";;;;
"Esos temazos mamarrachos que te avergüenzan pero que no puedes dejar de escuchar confeccionan lo que se conoce como ""GUILTY PLEASURES"".";;;;
"Empresas del sector confirman la fusión de ambas compañías, lo que supondría un hito en la historia de las ""JOINT VENTURES"" en Luxemburgo.";;;;
"Algunas voces alertan de que considerar el ""REVENGE DRESS"" como algo machista banaliza el gran poder que tiene la moda como lenguaje y sistema de comunicación.";;;;
"La labor del ""SENSITIVITY READER"" no es otra que la de detectar posibles sesgos, prejuicios o estereotipos indeseados en el texto en cuestión.";;;;
"Con su cebollita crujiente, su pan esponjoso y una salsa ligeramente agridulce, a quién no se le haría la boca agua con una ""SMASH BURGER"" como esta?";agridulce
"Hubo que esperar al ""TIE BREAK"" para ver a la tenista remontar y desplegar el juego ofensivo e implacable al que nos tiene acostumbrados.";;;;
"""BLUE COLLAR"", mujer y homosexual: la nueva estrella del partido republicano";;;;
"""CASUAL LOOKS"" con bufanda y guantes para triunfar esta temporada";;;;
"""DAD JEAN"" sin bolsillos y de tiro alto: la nueva moda en la pasarela de Milán";;;;
"""DATA SCIENTIST"", ingeniero de inteligencia artificial y técnico en visualización de datos son las carreras más demandadas ahora mismo en España";;;;
"""ESCAPE ROOMS"" de todo el mundo se reúnen estos días en Madrid para la mayor feria mundial de la industria";;;;
"""GLUTEN FREE"" y sin azúcar: el desayuno saludable que recomiendan los dietistas";;;;
"""LATE NIGHTS"" y actualidad son los géneros que copan la programación televisiva";;;;
"""PERSONAL TRAINER"" además de actriz, Smith se ganó el aplauso de la crítica con su primera película";;;;
"""RED CARPET"" pasada por agua en la quincuagésima tercera edición de los premios de la Academia";;;;
"""TIME LAPSE"" de la puesta de sol captado desde la marisma de Doñana";;;;
"Su trabajo como ""DATA SCIENTIST"" ha dado también frutos en el sector farmacéutico, donde sus modelos sobre plegamiento de proteínas han dado pie a una nueva generación de fármacos";;;;
"Tacones y vestidazos dejan hueco a ""CASUAL LOOKS"" más alegres y festivos, donde hasta el chándal tiene protagonismo.";;;;
"Un ""DAD JEAN"" es el vaquero de corte amplio y holgado que esperaríamos encontrar en el armario de un señor de más de 50 años y poco gusto por la moda.";;;;
"Los trabajadores ""BLUE COLLAR"" son el principal granero de votos del partido nacionalista, donde cosecha porcentajes de intención de voto de hasta el 50";;;;
"Para los escépticos de las discotecas o de los planes al aire libre, las ""ESCAPE ROOMS"" son una excelente opción para cumpleaños y celebraciones grupales diferentes.";;;;
"Los celíacos encontrarán en la carta apetitosas raciones ""GLUTEN FREE"" para escoger.";;;;
"La directora se ha dejado ver estos días como invitada en tertulias y diversos ""LATE NIGHTS"", donde ha contado algunos detalles del proceso creativo detrás de su primer documental.";;;;
"Solo, en clase colectiva o con ""PERSONAL TRAINER"", cualquier forma de ejercicio mejora la salud cardiovascular y la función genitourinaria.";;;;
"Ídolos, cantantes, actores, publicistas y hasta un cirujano en la ""RED CARPET"" más variopinta y estrafalaria que hemos visto en mucho tiempo.";;;;
"Requiere paciencia, buen equipamiento técnico y que la meteorología esté de nuestra parte, pero los resultados del ""TIME LAPSE"" merecen la pena y crearán un recuerdo espectacular para toda la vida.";;;;
"""TRENDSETTER"", mujer y homosexual: la nueva estrella del partido republicano";;;;
"""CUPCAKES"" sin azúcar pero con todo el sabor";;;;
"""OVERSIZE"", cómoda y versátil: la gabardina está de moda esta temporada";;;;
"""REBOOT"" del clásico setentero esta noche en TVE";;;;
"""SHARENTING"": cuando la vida de los hijos se convierte en negocio";;;;
"""SKYLINE"" de Nueva York en película de Woody Allen ""Manhattan""";;;;
"""SPOILERS"" del episodio siete a continuación";SPOILERS
"""STREAMER"", ingeniero de inteligencia artificial y técnico en visualización de datos son las carreras más demandadas ahora mismo en España";;;;
"""AFTERPARTY"" hasta el amanecer tras la gala de los premios de la Academia";;;;
"""CLIFFHANGER"" de infarto en ""Prision Break"" esta noche a las 21h en Cartoon Network";;;;
"""BEAUTY EXPERT"", ingeniero de inteligencia artificial y técnico en visualización de datos son las carreras más demandadas ahora mismo en España";;;;
"""FACT CHECKERS"" confirman que la cifra aportada por el ministerio no es correcta y solicitan más información a la fiscalía";;;;
"""FAST FASHION"": un problema de consumismo que afecta al medio ambiente";;;;
"""GIRL BANDS"" y solistas se suman a la campaña para reclamar mayor presencia femenina en los festivales de música";;;;
"""GLASS SKIN"": cómo conseguir el efecto piel de cristal que lucen las famosas";;;;
"""JUMPING JACKS"" para perder kilos sin salir de casa";;;;
"""KING SIZE"" y viscoelástico: el colchón que tu espalda necesita";;;;
"""TALK SHOWS"" y actualidad son los géneros que copan la programación televisiva";;;;
"""UGLY SHOES"" a todo color para para un verano fantástico";;;;
"""WEDDING PLANNERS"" de todo el mundo se reúnen estos días en Madrid para la mayor feria mundial de la industria";;;;
"Mariano Rajoy, el nuevo ""TRENDSETTER"" que agotó el abrigo que ha llevado en Washington DC.";;;;
"Los ""CUPCAKES"" son como magdalenas hipertrofiadas recubiertas por toneladas de azúcar y decoradas con todo tipo de fantasías hechas a golpe de colorante alimentario.";;;;
"No debemos subestimar las posibilidades de las prendas ""OVERSIZE"" para aportar un toque sofisticado y moderno a nuestra indumentaria.";;;;
"El ""REBOOT"" de la serie no se prevé para el próximo otoño, pero los fanáticos de la saga ya han comenzado a calentar motores.";;;;
"La madre ha sido acusada en numeriosas ocasiones de exponer a la menor en redes sociales en un caso claro de ""SHARENTING"".";;;;
"El perfil de la Almudena y del Palacio Real vistos desde el otro lado del río Manzanares perfilan la imagen del clásico ""SKYLINE"" madrileño.";;;;
"Las horas posteriores al estreno del capítulo son un campo de minas, porque es fácil tropezar involuntariamente con mensajes de desaprensivos llenos de ""SPOILERS"" y acabar comiéndose alguno.";SPOILERS
"En la ""AFTERPARTY"" del evento pudimos ver a algunas de las caras más conocidas del universo cinematográfico";;;;
"El capítulo terminó con un ""CLIFFHANGER"" inesperado que deja la trama en el aire";;;;
"El ""STREAMER"" ha negado las acusaciones que señalan que hizo publicidad encubierta, algo que la agencia europea condena con multas de hasta 50000 euros.";;;;
"La cobertura del debate electoral se hará con un ejército de ""FACT CHECKERS"" que se ocuparán de contrastar los datos aportados por los candidatos durante el programa.";;;;
"El problema de la ""FAST FASHION"" es triple: consume recursos desmesuradamente, produce toneladas de basura de difícil reciclaje y fomenta la explotación laboral de la industria textil.";;;;
"En los noventa asistimos a un auge de de presencia femenina en el mundo de la música, tanto solistas como Tracy Chapman o ""GIRL BANDS"" como las Spice Girls.";;;;
"Con los productos adecuados y una rutina de cuidado de la piel que seguiremos estrictamente, podemos lograr el aspecto ""GLASS SKIN"" o piel de cristal.";;;;
"Las sentadillas, las flexiones o los ""JUMPING JACKS"" son métodos muy efectivos para perder peso en un periodo corto de tiempo.";;;;
"Las tiendas de colchones confirman la tendencia creciente de las camas grandes; la tradicional cama de 1, 35 ha sido desplazada por el tamaño ""KING SIZE"" estadounidense, más propio de un hotel de lujo que de la típica casa española.";;;;
"La directora se ha dejado ver estos días como invitada en tertulias y diversos ""TALK SHOWS"", donde ha contado algunos detalles del proceso creativo detrás de su primer documental.";;;;
"Feos pero distinguidos, los ""UGLY SHOES"" que lució Nicole Kidman han agotado existencias en apenas unos días.";;;;
"Si la avalancha de tareas que conlleva organizar una boda reservar un sitio, elegir menú, encargar las flores, contratar una orquesta te abruman, debes saber que las ""WEDDING PLANNERS"" pueden ser tu solución.";;;;
"Puedes contratar una ""BEAUTY EXPERT"" y disfrutar del conocimiento para optimizar vuestras rutinas sin salir de casa.";;;;
"En Toronto habrá un ""FAN FESTIVAL"" de 3000 personas, que se reunirán para seguir el Barça Madrid";;;;
"Un ""FATAL ERROR"" ocurre típicamente cuando el programa intenta dividir por cero";;;;
"Durante su carrera profesional, también ha sido socio y director general de Ikea, ""GLOBAL DIRECTOR"" de Apple y director de Comunicación de Basket Market.";;;;
"En el ""ME TIME"" nosotras debemos ser la prioridad, ha de ser placentero y hemos de poder disfrutarlo sin interrupciones";;;;
"Los defensores del ""NATURAL TIME"" proponen distribuir el calendario en 13 meses de 28 días, lo que hace un total de 364 días.";;;;
"El concurso presentado por Aitor Albizua se ha consolidado en el ""PRIME TIME"" de Telecinco gracias a su participante estrella, un muchacho que está deslumbrando a los espectadores con su rapidez a la hora de resolver operaciones matemáticas.";;;;
"Las trabas burocráticas o ""RED TAPE"" que asolan su administración impiden que el flujo financiero de la UE abarque proyectos estratégicos para la reconversión del modelo productivo sueco";;;;
"Greensmaniac, el ""SALAD BAR"" de moda aterriza en Barcelona";Greensmaniac
"De hecho, lo que busca a través de sus ""SOCIAL MEDIA"" es lograr un contacto real y directo con sus seguidores.";;;;
"La reina Letizia ha escogido un conjunto ""TOTAL RED"" para la boda de los príncipes de de Holanda";;;;
"Si por el contrario tenemos la piel seca o deshidratada, es aconsejable elegir un ""PRIMER"" de efecto hidratante.";;;;
"Receta de ""PIE"" de limón paso a paso y sin horno";;;;
"Dragados pone a la venta su antigua sede central en Barcelona para vivienda ""PRIME""";;;;
"Pero si quieres aprovechar las rebajas, te proponemos un listado de ""GADGETS"" ""BEAUTY"" para sacarle todo el partido a los descuentos";;;;
"Acostumbrados a verla con autendos imposibles y maquillajes muy recargados, la modelo nos ha sorprendido con un ""LOOK"" ""EFFORTLESS"" sencillo y natural que le quita años y muestra su cara más informal.";;;;
"La agencia reivindica la publicidad en medios clásicos como la radio y la televisión y desaconseja fiarlo todo a campañas de ""MARKETING"" ""ONLINE"".";;;;
"Eduardo Noriega se ha hecho con el título de ""hombre mejor vestido de la velada"" gracias a su ""TRENCH"" ""OVERSIZE"" con mocasines a conjunto.";;;;
"Tras años en la industria de los videojuegos, dio un giro radical a su carrera y ahora trabaja como ""COACH"" ""WELLNESS"" asesorando a trabajadores quemados y personas en busca del bienestar físico y emocional";;;;
"La película es un ""THRILLER"" ""QUEER"" con esteroides, una crítica a todos los mensajes meritocráticos y de filosofía barata con los que nos inundan a diario";;;;
"Birkenstock, la marca que reafirma la tendencia de las ""SNEAKERS"" ""CHUNKY""";;;;
"Si el pincho USB convencional te da problemas, puedes probar con un ""PENDRIVE"" ""SMART"", que goza de conectividad autónoma y no necesita configuración externa.";;;;
